ID,ItemName,category,quantity,Unit,DogSize,Desctiption
90000,תערובת עגל ודגים,מזון,3,null,גדול,"מזון כלבים קשיח, עשוי מעגל ודגים, מתאים לבניית וחיזוק העצמות של הכלב"
90001,סלקל גורים,ציוד,1,null,קטן,"מנשא לגורים, עשוי צמר"
90002,גדר 1.2X0.9,ציוד,1,null,בינוני,"גדר כלבים עשויה מתכת, מתאימה לשימוש ביתי לכלבים בינוניים"
90003,גדר 1.5X1.2,ציוד,1,null,גדול,"גדר כלבים עשויה מתכת, מתאימה לשימוש ביתי לכלבים גדולים"
90004,צעצוע נשיכה מצפצף,צעצועים,2,null,קטן,"צעצוע לעיסה מצפצף, לחיזוק השיניים של הגור"
